hotel,address,latitude,longitude
IT,Milan,"['UNA Hotel Century', '18, Via Fabio Filzi, Centro Direzionale, Municipio 2, Milano, MI, LOM, 20124, Italia', 45.4841371, 9.2001623]"
IT,Milan,"['Hotel Portello Gruppo Minihotel', 'Portello, 12, Via Guglielmo Silva, Tre Torri, Milano, MI, LOM, 20148, Italia', 45.4802503, 9.1494925]"
IT,Milan,"['Hotel Silver', 'silver motel, Via Riccardo Lombardi, Municipio 7, Assiano, MI, LOM, 20019, Italia', 45.4589731, 9.0687506]"
IT,Milan,"['Hotel Lombardia', 'Hotel Lombardia, Viale Lombardia, Casoretto, Milano, MI, LOM, 20132, Italia', 45.4872511, 9.2237385]"
IT,Milan,"['UNA Hotel Scandinavia', ""Mercato rionale di via Fauche', Via Giovanni Battista Fauche', Zona Sempione, Bullona, Milano, MI, LOM, 20121, Italia"", 45.4859983, 9.1637603]"
IT,Milan,"['Hotel Principe Di Savoia', 'Principe di Savoia, 17, Piazza della Repubblica, Porta Nuova, Milano, MI, LOM, 20124, Italia', 45.479888, 9.1962982]"
IT,Milan,"['Hotel Carrobbio', 'Hotel Ariston, Via Medici, Carrobbio, Municipio 1, Milano, MI, LOM, 20123, Italia', 45.4606597, 9.1810947]"
IT,Milan,"['DoubleTree By Hilton Milan', 'DoubleTree by Hilton Hotel Milan, 77, Via Ludovico di Breme, Quartiere Varesina, Municipio 8, Milano, MI, LOM, 20156, Italia', 45.5005657, 9.1383663]"
IT,Milan,"['Bianca Maria Palace Hotel', 'Bianca Maria, Viale Premuda, Porta Monforte, Milano, MI, LOM, 20121, Italia', 45.4635445, 9.2068649]"
IT,Milan,"['Hotel D Este', 'Vigentina, Viale Bligny, Porta Vigentina, Municipio 5, Milano, MI, LOM, 20136, Italia', 45.4510397, 9.1920911]"
IT,Milan,"['Hotel Liberty', 'Porta Vigentina, Viale Bligny, Porta Vigentina, Municipio 5, Milano, MI, LOM, 20136, Italia', 45.4508673, 9.1948659]"
IT,Milan,"['Hotel VIU Milan', 'Holiday Inn, 1/A, Via Ugo Bassi, Zona Farini, Isola, Milano, MI, LOM, 20159, Italia', 45.488764, 9.183057]"
IT,Milan,"['Starhotels Echo', 'Starhotel Echo, 4, Viale Andrea Doria, Centrale, Municipio 2, Milano, MI, LOM, 20124, Italia', 45.4847398, 9.2072916]"
IT,Milan,"['Hotel Da Vinci', '6, Via Senigallia, Bruzzano, Milano, MI, LOM, 20095, Italia', 45.5331372, 9.1711019]"
IT,Milan,"['Ca Bianca Hotel Corte Del Naviglio', ""Ca' Granda - Hotel Corte del Naviglio, Via Lodovico il Moro, Restocco Maroni, Milano, MI, LOM, 20144, Italia"", 45.443502, 9.1377081]"
IT,Milan,"['UNA Hotel Cusani', 'UNA hotel Cusani, 13, Via Cusani, Castello, Municipio 1, Milano, MI, LOM, 20121, Italia', 45.4684251, 9.1834161]"
IT,Milan,"['NH Milano Palazzo Moscova', 'Hotel Maison Moschino, 12, Viale Monte Grappa, Municipio 1, Milano, MI, LOM, 20124, Italia', 45.480968, 9.189977]"
IT,Milan,"['Antares Hotel Rubens', 'Hotel Rubens, 21, Via Pietro Rubens, Molinazzo, Milano, MI, LOM, 20148, Italia', 45.4670579, 9.1427822]"
IT,Milan,"['Best Western Madison Hotel', 'Madison Hotel, Via Leopoldo Gasparotto, Centrale, Municipio 2, Milano, MI, LOM, 20124, Italia', 45.4881471, 9.2016609]"
IT,Milan,"['Hotel Mozart', 'Best Western Hotel Mozart, Via Giuseppe Mussi, Zona Sempione, Bullona, Milano, MI, LOM, 20154, Italia', 45.4834133, 9.1666361]"
IT,Milan,"['Novotel Milano Nord Ca Granda', 'Ibis Milano Ca Granda, Via Val Cismon, Pratocentenaro, Milano, MI, LOM, 20124, Italia', 45.506502, 9.1965192]"
IT,Milan,"['Hotel Capitol Milano', 'Hotel Capitol, 6, Via Domenico Cimarosa, Porta Vercellina, Milano, MI, LOM, 20145, Italia', 45.4661781, 9.1588367]"
IT,Milan,"['Hotel Magna Pars Small Luxury Hotels of the World', 'Hotel Magna Pars Suites, Via Vincenzo Forcella, Zona Tortona, Municipio 6, Milano, MI, LOM, 20136, Italia', 45.4524879, 9.1669784]"
IT,Milan,"['Hotel Spadari Al Duomo', 'Hotel Spadari, 11, Via Spadari, Cordusio, Municipio 1, Milano, MI, LOM, 20123, Italia', 45.463579, 9.1869092]"
IT,Milan,"['Hotel Galileo', 'Galileo, 9, Corso Europa, Verziere, Municipio 1, Milano, MI, LOM, 20121, Italia', 45.4642651, 9.1960569]"
IT,Milan,"['Andreola Central Hotel', 'Diffusione, 39, Via Luigi Settembrini, Centrale, Municipio 2, Milano, MI, LOM, 20124, Italia', 45.4836517, 9.2078581]"
IT,Milan,"['Atahotel Contessa Jolanda', 'Contessa Jolanda Residence, Via Antonino Giuffrè, Montalbino, Milano, MI, LOM, 20124, Italia', 45.4984161, 9.1904375]"
IT,Milan,"['Starhotels Ritz', 'Starhotels Ritz, 40, Via Lazzaro Spallanzani, Zona Buenos Aires, Municipio 3, Milano, MI, LOM, 20129, Italia', 45.4779041, 9.2094965]"
IT,Milan,"['Mercure Milano Regency', 'Regency Hotel, Via Lorenzo Bartolini, Cagnola, Milano, MI, LOM, 20148, Italia', 45.4897688, 9.1549451]"
IT,Milan,"['Four Points Sheraton Milan Center', 'Qui si mangia, 33, Via Gustavo Fara, Centro Direzionale, Municipio 2, Milano, MI, LOM, 20124, Italia', 45.4851889, 9.198015]"
IT,Milan,"['Grand Visconti Palace', 'Grand Visconti Palace, 14, Viale Isonzo, Morivione, Municipio 5, Milano, MI, LOM, 20141, Italia', 45.4471408, 9.2070051]"
IT,Milan,"['Carlyle Brera Hotel', 'Carlyle Brera Hotel, 84, Corso Giuseppe Garibaldi, Municipio 1, Milano, MI, LOM, 20121, Italia', 45.4769923, 9.1844899]"
IT,Milan,"['Hilton Milan', 'Europcar, Via Luigi Galvani, Centro Direzionale, Municipio 2, Milano, MI, LOM, 20124, Italia', 45.4862032, 9.200322]"
IT,Milan,"['Hotel Dieci', 'Largo Rio de Janeiro, Città Studi, Milano, MI, LOM, 20124, Italia', 45.4738012, 9.2239702]"
IT,Milan,"['Mokinba Hotels Montebianco', 'Montebianco, 90, Via Monte Rosa, Molinazzo, Milano, MI, LOM, 20149, Italia', 45.4788051, 9.1446276]"
IT,Milan,"['Camperio House Suites Apartments', '8, Via Manfredo Camperio, Cordusio, Municipio 1, Milano, MI, LOM, 20123, Italia', 45.466598, 9.183064]"
IT,Milan,"['Rosa Grand Milano Starhotels Collezione', '3, Piazza Fontana, Pasquirolo, Municipio 1, Milano, MI, LOM, 20122, Italia', 45.4638223, 9.1940273]"
IT,Milan,"['Hilton Garden Inn Milan North', 'Hilton Garden Inn Milan North, 36, Via Lucio Giunio Columella, Precotto, Milano, MI, LOM, 20128, Italia', 45.5161671, 9.2272778]"
IT,Milan,"['Antica Locanda Dei Mercanti', 'Antica Locanda dei Mercanti, 6, Via San Tomaso, Cordusio, Municipio 1, Milano, MI, LOM, 20121, Italia', 45.467298, 9.1846982]"
IT,Milan,"['NH Milano Touring', 'NH Milano Touring, 2, Via Ugo Iginio Tarchetti, Porta Nuova, Milano, MI, LOM, 20121, Italia', 45.4769167, 9.196665]"
IT,Milan,"['Best Western Hotel Astoria', 'BVD Istituto di bellezza, 11, Viale Murillo, Molinazzo, Milano, MI, LOM, 20149, Italia', 45.4725167, 9.1439198]"
IT,Milan,"['Palazzo Parigi Hotel Grand Spa Milano', 'Palazzo Parigi, Corso di Porta Nuova, Borgonuovo, Porta Nuova, Milano, MI, LOM, 20121, Italia', 45.473348, 9.1910733]"
IT,Milan,"['Hotel Mercure Milano Centro', 'Hotel Mercure Milano Centro, Piazza Guglielmo Oberdan, Porta Venezia, Milano, MI, LOM, 20124, Italia', 45.4747809, 9.2059385]"
IT,Milan,"['Best Western Hotel Ascot', '5, Via Lentasio, Municipio 1, Milano, MI, LOM, 20123, Italia', 45.4580137, 9.1913676]"
IT,Milan,"['Best Western Antares Hotel Concorde', 'Gorla, Via privata Giancarlo Puecher, Municipio 2, Milano, MI, LOM, 20127, Italia', 45.502453, 9.2218364]"
IT,Milan,"['Hotel degli Arcimboldi', 'Hotel degli Arcimboldi, Viale Sarca, Bicocca, Milano, MI, LOM, 20132, Italia', 45.5257221, 9.2150033]"
IT,Milan,"['LHP Hotel Napoleon', 'Hotel Napoleon, 12, Via Federico Ozanam, Zona Buenos Aires, Municipio 3, Milano, MI, LOM, 20124, Italia', 45.4802415, 9.2131919]"
IT,Milan,"['Klima Hotel Milano Fiere', 'Klima Hotel Milano Fiere, 8, Via privata Venezia Giulia, Musocco, Milano, MI, LOM, 20157, Italia', 45.5147974, 9.116606]"
IT,Milan,"['Hotel Vittoria', 'Punto SMA, 2/4, Via Lodovico Mancini, Municipio 4, Milano, MI, LOM, 20121, Italia', 45.463135, 9.2102]"
IT,Milan,"['Colombia', 'Hotel Colombia, 15, Via Roberto Lepetit, Centrale, Municipio 2, Milano, MI, LOM, 20124, Italia', 45.4829817, 9.2041911]"
IT,Milan,"['Milan Marriott Hotel', 'Hotel Marriot Milano, Piazza Carlo Irnerio, La Maddalena, Milano, MI, LOM, 20145, Italia', 45.4611287, 9.1542675]"
IT,Milan,"['Boscolo Milano Autograph Collection', '1, Corso Giacomo Matteotti, San Babila, Municipio 1, Milano, MI, LOM, 20121, Italia', 45.46676, 9.194293]"
IT,Milan,"['Hotel Lloyd', '48, Corso di Porta Romana, Brolo-Pantano, Municipio 1, Milano, MI, LOM, 20123, Italia', 45.4580781, 9.1924205]"
IT,Milan,"['Art Hotel Navigli', 'Zona Navigli, Via Angelo Fumagalli, Zona Navigli, Municipio 6, Milano, MI, LOM, 20136, Italia', 45.4501306, 9.1696481]"
IT,Milan,"['Acca Palace', 'Acca Palace, 9, Via Giovanni Nicotera, Affori, Milano, MI, LOM, 20161, Italia', 45.5099969, 9.1739942]"
IT,Milan,"['Enterprise Hotel Design Boutique', 'Hotel Enterprise, Corso Sempione, Zona Sempione, Portello, Milano, MI, LOM, 20148, Italia', 45.4867005, 9.1575137]"
IT,Milan,"['NYX Milan', 'Stazione Centrale M2 M3, Piazza Quattro Novembre, Centrale, Municipio 2, Milano, MI, LOM, 20124, Italia', 45.4868745, 9.2018406]"
IT,Milan,"['Excelsior Hotel Gallia Luxury Collection Hotel', ""Excelsior Hotel Gallia, Piazza Duca d'Aosta, Centrale, Municipio 2, Milano, MI, LOM, 20124, Italia"", 45.4857027, 9.2020127]"
IT,Milan,"['Hotel Dei Cavalieri', 'Hotel dei Cavalieri, 1, Piazza Giuseppe Missori, Bottonuto, Municipio 1, Milano, MI, LOM, 20123, Italia', 45.4608547, 9.1886179]"
IT,Milan,"['Armani Hotel Milano', 'Armani Building, Via Alessandro Manzoni, Borgonuovo, Municipio 1, Milano, MI, LOM, 20121, Italia', 45.470532, 9.19302]"
IT,Milan,"['Park Hyatt Milano', 'Park Hyatt Milano, 1, Via Tommaso Grossi, Scala, Municipio 1, Milano, MI, LOM, 20121, Italia', 45.4654912, 9.1889612]"
IT,Milan,"['TH Street Duomo', '14, Via Santa Radegonda, Duomo, Municipio 1, Milano, MI, LOM, 20121, Italia', 45.4657568, 9.1916674]"
IT,Milan,"['The Westin Palace', 'Westin Palace, 20, Piazza della Repubblica, Porta Nuova, Milano, MI, LOM, 20124, Italia', 45.4790357, 9.199028]"
IT,Milan,"['Maison Borella', 'Maison Borella, 8, Alzaia Naviglio Grande, Zona Navigli, Municipio 6, Milano, MI, LOM, 20144, Italia', 45.4521067, 9.1758135]"
IT,Milan,"['Style Hotel', 'Style Hotel, 1, Via delle Erbe, Brera, Municipio 1, Milano, MI, LOM, 20121, Italia', 45.4708973, 9.1840992]"
IT,Milan,"['ME Milan Il Duca', 'Hotel Melià Il Duca, 13, Piazza della Repubblica, Porta Nuova, Milano, MI, LOM, 20124, Italia', 45.4793852, 9.1961308]"
IT,Milan,"['ADI Doria Grand Hotel', 'Il Capriccio, Viale Andrea Doria, Zona Buenos Aires, Municipio 3, Milano, MI, LOM, 20124, Italia', 45.4853717, 9.2115837]"
IT,Milan,"['Hotel Manin', 'Hotel Manin, 7, Via Daniele Manin, Porta Nuova, Milano, MI, LOM, 20121, Italia', 45.4739801, 9.1960671]"
IT,Milan,"['Hotel Michelangelo', 'Centrale, Via Roberto Lepetit, Centrale, Municipio 2, Milano, MI, LOM, 20124, Italia', 45.4845143, 9.2057532]"
IT,Milan,"['Four Seasons Hotel Milano', 'Quadrilatero della Moda, Via Gesù, Quadrilatero della Moda, Municipio 1, Milano, MI, LOM, 20121, Italia', 45.469339, 9.195108]"
IT,Milan,"['ADI Hotel Poliziano Fiera', '9, Via Poliziano, Zona Sempione, Municipio 8, Milano, MI, LOM, 20154, Italia', 45.4837173, 9.1649371]"
IT,Milan,"['IH Hotels Milano Lorenteggio', 'Lorenteggio, Via Lorenteggio, Lorenteggio, Milano, MI, LOM, 20147, Italia', 45.4436132, 9.1161094]"
IT,Milan,"['The Square Milano Duomo', 'Hotel dei Cavalieri, 1, Piazza Giuseppe Missori, Bottonuto, Municipio 1, Milano, MI, LOM, 20123, Italia', 45.4608604, 9.1890215]"
IT,Milan,"['Hotel Milano Scala', ""Bar Prima Donna, Via dell'Orso, Brera, Municipio 1, Milano, MI, LOM, 20121, Italia"", 45.4689376, 9.1868891]"
IT,Milan,"['Hotel Tiziano Park Vita Parcour Gruppo MiniHotels', 'MiniHotel Tiziano, 6, Via Tiziano, San Pietro, Municipio 8, Milano, MI, LOM, 20145, Italia', 45.4709657, 9.1566242]"
IT,Milan,"['Hotel Regina', 'Cartoleria Correnti, 20, Via Cesare Correnti, Carrobbio, Porta Genova, Milano, MI, LOM, 20123, Italia', 45.459485, 9.179511]"
IT,Milan,"['Ramada Plaza Milano', ""Hotel Ramada, 27, Via Stamira D'Ancona, Turro, Milano, MI, LOM, 20127, Italia"", 45.501946, 9.2277569]"
IT,Milan,"['Starhotels Tourist', '300, Viale Fulvio Testi, Bicocca, Milano, MI, LOM, 20095, Italia', 45.5266395, 9.2131549]"
IT,Milan,"['Holiday Inn Milan Garibaldi Station', 'Holiday Inn, 1/A, Via Ugo Bassi, Zona Farini, Isola, Milano, MI, LOM, 20159, Italia', 45.488764, 9.183057]"
IT,Milan,"['Hotel Raffaello', '110, Viale Certosa, Boldinasco, Milano, MI, LOM, 20148, Italia', 45.494861, 9.141551]"
IT,Milan,"['Uptown Palace', 'Uptown Palace, 10, Via Santa Sofia, Porta Lodovica, Milano, MI, LOM, 20122, Italia', 45.4574655, 9.1919138]"
IT,Milan,"['Best Western Hotel St George', 'Hotel St. George, 9, Viale Tunisia, Lazzaretto, Municipio 3, Milano, MI, LOM, 20124, Italia', 45.4770906, 9.2054208]"
IT,Milan,"['Milan Suite Hotel', 'Tranvia Milano-Saronno-Tradate, Via Varesina, Quartiere Varesina, Municipio 8, Milano, MI, LOM, 20148, Italia', 45.5000245, 9.1428722]"
IT,Milan,"['Hotel Mediolanum', 'Hotel Mediolanum, 1, Via Mauro Macchi, Centrale, Municipio 2, Milano, MI, LOM, 20124, Italia', 45.4813423, 9.2039494]"
IT,Milan,"['MiHotel', 'Via dei Fontanili, Morivione, Municipio 5, Milano, MI, LOM, 20141, Italia', 45.4405621, 9.1921165]"
IT,Milan,"['LaGare Hotel Milano Centrale MGallery by Sofitel', 'La Gare, 20, Via Giovanni Battista Pirelli, Centro Direzionale, Municipio 2, Milano, MI, LOM, 20124, Italia', 45.484237, 9.198858]"
IT,Milan,"['Worldhotel Cristoforo Colombo', 'Kiko, 3, Corso Buenos Aires, Zona Buenos Aires, Porta Venezia, Milano, MI, LOM, 20129, Italia', 45.4758842, 9.205791]"
IT,Milan,"['The Hub Hotel', 'The Hub, 10, Via privata Polonia, Musocco, Milano, MI, LOM, 20148, Italia', 45.5138582, 9.1194759]"
IT,Milan,"['Hotel Crivi s', ""Crivi's Hotel, Via Carlo Crivelli, Quadronno, Municipio 1, Milano, MI, LOM, 20123, Italia"", 45.4529643, 9.1962217]"
IT,Milan,"['Palazzo Segreti', 'Palazzo Segreti, 8/B, Via San Tomaso, Cordusio, Municipio 1, Milano, MI, LOM, 20121, Italia', 45.4672309, 9.184154]"
IT,Milan,"['TownHouse Duomo', 'TownHouse Duomo Milano, 2, Via Silvio Pellico, Duomo, Municipio 1, Milano, MI, LOM, 20121, Italia', 45.4648822, 9.1893265]"
IT,Milan,"['NH Milano Machiavelli', 'NH Machiavelli, 5, Via Lazzaretto, Lazzaretto, Porta Nuova, Milano, MI, LOM, 20124, Italia', 45.4776167, 9.2016244]"
IT,Milan,"['Mandarin Oriental Milan', 'Mandarin Oriental, 9, Via Andegari, Scala, Municipio 1, Milano, MI, LOM, 20121, Italia', 45.4694772, 9.1909325]"
IT,Milan,"['Hotel Wagner', 'Punto SMA, 11, Via Michelangelo Buonarroti, San Pietro, Municipio 7, Milano, MI, LOM, 20145, Italia', 45.4684949, 9.1550355]"
IT,Milan,"['Hotel Sunflower', 'Sunflower, Piazzale Lugano, Derganino, Municipio 9, Milano, MI, LOM, 20121, Italia', 45.498503, 9.1664111]"
IT,Milan,"['Best Western Hotel City', ""Yamamay, 1, Piazza Duca d'Aosta, Centrale, Municipio 2, Milano, MI, LOM, 20124, Italia"", 45.4858877, 9.2042827]"
IT,Milan,"['Hotel Boutique Duomo', '40, Via Mac Mahon, Ghisolfa, Milano, MI, LOM, 20148, Italia', 45.4909585, 9.1614268]"
IT,Milan,"['Hotel Manzoni', 'Quadrilatero della Moda, Via Gesù, Quadrilatero della Moda, Municipio 1, Milano, MI, LOM, 20121, Italia', 45.470238, 9.195347]"
IT,Milan,"['Best Western Atlantic Hotel', 'Osteria Italiana, 22, Via Napo Torriani, Centrale, Municipio 2, Milano, MI, LOM, 20124, Italia', 45.4830211, 9.2033246]"
IT,Milan,"['Antares Hotel Accademia', '68, Viale Certosa, Cagnola, Milano, MI, LOM, 20148, Italia', 45.4921089, 9.1476806]"
