hotel,address,latitude,longitude
AT,Vienna,"['K K Palais Hotel', '11, Rudolfsplatz, Textilviertel, KG Innere Stadt, Innere Stadt, Wien, 1010, Österreich', 48.2138096, 16.3714293]"
AT,Vienna,"['Hotel Sans Souci Wien', 'NÖ Gebietskrankenkasse, 2, Burggasse, KG Neubau, Neubau, Wien, 1070, Österreich', 48.204576, 16.3563661]"
AT,Vienna,"['Hotel Johann Strauss', '2, Floragasse, Freihausviertel, KG Wieden, Wieden, Wien, 1040, Österreich', 48.1949694, 16.3692624]"
AT,Vienna,"['Suite Hotel 900 m zur Oper', '44, Wiedner Hauptstraße, Schaumburgergrund, KG Wieden, Wieden, Wien, 1040, Österreich', 48.1935235, 16.3669145]"
AT,Vienna,"['Senator Hotel Vienna', 'Senator Hotel**** Vienna, 105, Hernalser Hauptstraße, KG Hernals, Hernals, Wien, 1170, Österreich', 48.2195864, 16.3255339]"
AT,Vienna,"['Arthotel ANA Boutique Six', 'The Hotel 1060 Vienna, 23, Webgasse, Obere Windmühle, KG Mariahilf, Mariahilf, Wien, 1060, Österreich', 48.1941905, 16.3462578]"
AT,Vienna,"['Mercure Vienna First', '8, Judengasse, Bermudadreieck, KG Innere Stadt, Innere Stadt, Wien, 1010, Österreich', 48.2114567, 16.3738677]"
AT,Vienna,"['Vienna Sporthotel', 'Vienna Sporthotel, 83, Baumgasse, Erdberger Mais, KG Landstraße, Landstraße, Wien, 1030, Österreich', 48.191373, 16.4082294]"
AT,Vienna,"['Das Opernring Hotel', '11, Opernring, Kärntner Viertel, KG Innere Stadt, Innere Stadt, Wien, 1010, Österreich', 48.2026449, 16.3671054]"
AT,Vienna,"['Pertschy Palais Hotel', 'Palais Hotel Pertschy, 5, Habsburgergasse, Widmerviertel, KG Innere Stadt, Innere Stadt, Wien, 1010, Österreich', 48.2082256, 16.3684123]"
AT,Vienna,"['Hilton Vienna Plaza', 'Hilton Vienna Plaza, 11, Schottenring, Schottenviertel, KG Innere Stadt, Innere Stadt, Wien, 1010, Österreich', 48.2155236, 16.3646858]"
AT,Vienna,"['Austria Trend Hotel Doppio Wien', '1, Simmeringer Hauptstraße, Karrée St. Marx, KG Landstraße, Landstraße, Wien, 1110, Österreich', 48.1854312, 16.404884]"
AT,Vienna,"['The Ritz Carlton Vienna', 'Ritz Carlton, Schubertring, Stubenviertel, KG Innere Stadt, Innere Stadt, Wien, 1010, Österreich', 48.2022742, 16.3762615]"
AT,Vienna,"['Hotel Bellevue Wien', 'Bellevue, 5, Althanstraße, Thurygrund II, KG Alsergrund, Alsergrund, Wien, 1090, Österreich', 48.2264063, 16.3600628]"
AT,Vienna,"['Grand Hotel Wien', 'Palais Corso, Kärntner Ring, Kärntner Viertel, KG Innere Stadt, Innere Stadt, Wien, 1010, Österreich', 48.2021105, 16.3720841]"
AT,Vienna,"['Exe Vienna', 'Hotel Eurostars Vienna, 34-36, Ottakringer Straße, KG Hernals, Ottakring, Wien, 1170, Österreich', 48.2149414, 16.3365285]"
AT,Vienna,"['Mercure Secession Wien', '5, Getreidemarkt, KG Mariahilf, Mariahilf, Wien, 1060, Österreich', 48.200561, 16.3647063]"
AT,Vienna,"['Hotel Capricorno', 'Hotel Capricorno, 3-4, Schwedenplatz, Stubenviertel, KG Innere Stadt, Innere Stadt, Wien, 1010, Österreich', 48.2111522, 16.3788631]"
AT,Vienna,"['Hotel Bristol A Luxury Collection Hotel', 'Hotel Bristol, 1, Kärntner Ring, Kärntner Viertel, KG Innere Stadt, Innere Stadt, Wien, 1010, Österreich', 48.2024907, 16.3702656]"
AT,Vienna,"['Grand Ferdinand Vienna Your Hotel In The City Center', 'Meissl & Schadn, 10-12, Schubertring, Kärntner Viertel, KG Innere Stadt, Innere Stadt, Wien, 1010, Österreich', 48.2022415, 16.3749336]"
AT,Vienna,"['Park Inn by Radisson Uno City Vienna', 'Park Inn, 16-18, Wagramer Straße, KG Kaisermühlen, Donaustadt, Neukagran, Wien, 1220, Österreich', 48.2340799, 16.4210093]"
AT,Vienna,"['25hours Hotel beim MuseumsQuartier', '25hours Hotel, 1-3, Lerchenfelder Straße, Buchfeld, KG Josefstadt, Josefstadt, Wien, 1070, Österreich', 48.2064745, 16.3546297]"
AT,Vienna,"['Alma Boutique Hotel', '15, Franz-Josefs-Kai, Stubenviertel, KG Innere Stadt, Innere Stadt, Wien, 1010, Österreich', 48.2112491, 16.3776519]"
AT,Vienna,"['Hotel Parco di Sch nbrunn Vienna', ""Casa D'Oro Luciani, 32, Ratschkygasse, Untermeidling, KG Meidling, Meidling, Kabelwerk, Wien, 1120, Österreich"", 48.1776236, 16.3243588]"
AT,Vienna,"['Hotel Regina', 'Hotel Regina, 15, Rooseveltplatz, KG Alsergrund, Alsergrund, Wien, 1090, Österreich', 48.2163343, 16.3595536]"
AT,Vienna,"['Hotel Erzherzog Rainer', '27-29, Wiedner Hauptstraße, Freihausviertel, KG Wieden, Wieden, Wien, 1040, Österreich', 48.1953229, 16.3672882]"
AT,Vienna,"['Hotel Kaiserin Elisabeth', '3, Weihburggasse, Kärntner Viertel, KG Innere Stadt, Innere Stadt, Wien, 1010, Österreich', 48.2072348, 16.372238]"
AT,Vienna,"['Hotel Am Konzerthaus Vienna MGallery by Sofitel', 'Hotel am Konzerthaus, 35-37, Am Heumarkt, Botschaftsviertel, KG Landstraße, Landstraße, Wien, 1030, Österreich', 48.1996129, 16.3773546]"
AT,Vienna,"['pentahotel Vienna', 'Pentahotel, 92, Margaretenstraße, Nikolsdorf, KG Margarethen, Margareten, Wien, 1050, Österreich', 48.1899743, 16.3567007]"
AT,Vienna,"['Hotel Stefanie', 'Produktenbörse, Durchhaus Taborstraße 10, Karmeliterviertel, KG Leopoldstadt, Leopoldstadt, Wien, 1020, Österreich', 48.2142766, 16.3801779]"
AT,Vienna,"['Hotel Amadeus', '5, Wildpretmarkt, Stubenviertel, KG Innere Stadt, Innere Stadt, Wien, 1010, Österreich', 48.2104468, 16.3715781]"
AT,Vienna,"['Gartenhotel Altmannsdorf Hotel 1', 'Gartenhotel Altmannsdorf, 26-28, Hoffingergasse, KG Altmannsdorf, Meidling, Kabelwerk, Wien, 1120, Österreich', 48.1640345, 16.3216061]"
AT,Vienna,"['DO CO Hotel Vienna', 'Haas-Haus, Stock-im-Eisen-Platz, Kärntner Viertel, KG Innere Stadt, Innere Stadt, Wien, 1010, Österreich', 48.2082385, 16.3715725]"
AT,Vienna,"['Hotel Topazz', '3, Lichtensteg, Stubenviertel, KG Innere Stadt, Innere Stadt, Wien, 1010, Österreich', 48.210285, 16.373579]"
AT,Vienna,"['FourSide Hotel Suites Vienna', 'FourSide Hotel & Suites Vienna, 25-27, Freytaggasse, KG Floridsdorf, Floridsdorf, Neujedlersdorf, Wien, 1210, Österreich', 48.2565936, 16.4031426]"
AT,Vienna,"['Palais Coburg Residenz', 'Palais Coburg, Seilerstätte, Stubenviertel, KG Innere Stadt, Innere Stadt, Wien, 1010, Österreich', 48.2058584, 16.3766545]"
AT,Vienna,"['Arthotel ANA Prime', '41, Schönbrunner Straße, KG Margarethen, Margareten, Wien, 1050, Österreich', 48.1925582, 16.3576071]"
AT,Vienna,"['Hotel Kavalier', '163, Linzer Straße, KG Penzing, Penzing, Wien, 1140, Österreich', 48.1940487, 16.2971831]"
AT,Vienna,"['Falkensteiner Hotel Wien Zentrum Schottenfeld', 'Falkensteiner, 74, Schottenfeldgasse, Lerchenfeld, KG Neubau, Neubau, Wien, 1070, Österreich', 48.2048494, 16.343618]"
AT,Vienna,"['Pakat Suites Hotel', 'Pakat Suites Hotel, 5, Mommsengasse, KG Wieden, Wieden, Wien, 1040, Österreich', 48.19183, 16.3770876]"
AT,Vienna,"['NH Wien Belvedere', 'NH Belvedere, 12a, Rennweg, Botschaftsviertel, KG Landstraße, Landstraße, Wien, 1030, Österreich', 48.1954348, 16.383429]"
AT,Vienna,"['IntercityHotel Wien', '3, Kaiserstraße, KG Neubau, Neubau, Wien, 1070, Österreich', 48.1965878, 16.3413729]"
AT,Vienna,"['Palais Hansen Kempinski Vienna', 'Palais Hansen, Schottenring, Textilviertel, KG Innere Stadt, Innere Stadt, Wien, 1010, Österreich', 48.2163149, 16.3685103]"
AT,Vienna,"['Austria Trend Hotel Europa Wien', '3, Neuer Markt, Kärntner Viertel, KG Innere Stadt, Innere Stadt, Wien, 1010, Österreich', 48.2062103, 16.3710387]"
AT,Vienna,"['NH Wien City', '32, Mariahilfer Straße, Untere Windmühle, KG Mariahilf, Mariahilf, Wien, 1070, Österreich', 48.2002872, 16.3547746]"
AT,Vienna,"['Lindner Hotel Am Belvedere', 'Lindner Hotel am Belvedere, 12, Rennweg, Botschaftsviertel, KG Landstraße, Landstraße, Wien, 1030, Österreich', 48.1955998, 16.3826989]"
AT,Vienna,"['Appartement Hotel an der Riemergasse', '8, Riemergasse, Stubenviertel, KG Innere Stadt, Innere Stadt, Wien, 1010, Österreich', 48.2071576, 16.3765913]"
AT,Vienna,"['Mercure Grand Hotel Biedermeier Wien', '28, Landstraßer Hauptstraße, Botschaftsviertel, KG Landstraße, Landstraße, Wien, 1030, Österreich', 48.2038688, 16.3887039]"
AT,Vienna,"['Hotel Vienna', '31, Große Stadtgutgasse, Afrikanerviertel, KG Leopoldstadt, Leopoldstadt, Wien, 1020, Österreich', 48.2196722, 16.3863588]"
AT,Vienna,"['Hotel Zeitgeist Vienna Hauptbahnhof', '13, Sonnwendgasse, Sonnwendviertel, KG Favoriten, Favoriten, Wien, 1100, Österreich', 48.1829645, 16.3776709]"
AT,Vienna,"['Hotel Royal', 'Ristorante Settimo Cielo, 3, Singerstraße, Kärntner Viertel, KG Innere Stadt, Innere Stadt, Wien, 1010, Österreich', 48.2078727, 16.3724042]"
AT,Vienna,"['Eurostars Embassy', 'Di@rdamo, Eslarngasse, Fasanviertel, KG Landstraße, Landstraße, Wien, 1030, Österreich', 48.1964001, 16.3958668]"
AT,Vienna,"['Hotel Wandl', '9, Petersplatz, Widmerviertel, KG Innere Stadt, Innere Stadt, Wien, 1010, Österreich', 48.2097026, 16.3703902]"
AT,Vienna,"['City Rooms', '1, Daungasse, Buchfeld, KG Josefstadt, Josefstadt, Wien, 1080, Österreich', 48.2133296, 16.3471399]"
AT,Vienna,"['The Ring Vienna s Casual Luxury Hotel', 'The Ring, 8, Kärntner Ring, Kärntner Viertel, KG Innere Stadt, Innere Stadt, Wien, 1010, Österreich', 48.2017091, 16.3710205]"
AT,Vienna,"['Hotel ViennArt am Museumsquartier', 'Zu den drei großen Kronen, Kirchberggasse, KG Neubau, Neubau, Wien, 1070, Österreich', 48.2035677, 16.356445]"
AT,Vienna,"['Hilton Garden Inn Vienna South', 'Hilton Garden Inn Vienna South, 5, Hertha-Firnberg-Straße, Triesterviertel, KG Inzersdorf Stadt, Favoriten, Wien, 1100, Österreich', 48.1667886, 16.344908]"
AT,Vienna,"['Austria Trend Parkhotel Sch nbrunn Wien', '10-16, Hietzinger Hauptstraße, KG Hietzing, Hietzing, Wien, 1130, Österreich', 48.1866506, 16.3023375]"
AT,Vienna,"['Hollmann Beletage Design Boutique', '6, Köllnerhofgasse, Stubenviertel, KG Innere Stadt, Innere Stadt, Wien, 1010, Österreich', 48.2105156, 16.3760717]"
AT,Vienna,"['Steigenberger Hotel Herrenhof', 'Steigenberger Hotel Herrenhof, 10, Herrengasse, Schottenviertel, KG Innere Stadt, Innere Stadt, Wien, 1010, Österreich', 48.2097958, 16.3658705]"
AT,Vienna,"['Hotel Corvinus', 'Corvinus, 57-59, Mariahilfer Straße, Ratzenstadl, KG Mariahilf, Mariahilf, Wien, 1060, Österreich', 48.1990335, 16.3525051]"
AT,Vienna,"['Rainers Hotel Vienna', 'Rainers Hotel, 184, Gudrunstraße, KG Favoriten, Favoriten, Wien, 1100, Österreich', 48.1791893, 16.3625367]"
AT,Vienna,"['Hotel Gallitzinberg', 'Hotel Gallitzinberg, 32, Johann-Staud-Straße, KG Ottakring, Ottakring, Wien, 1160, Österreich', 48.2145071, 16.2845042]"
AT,Vienna,"['The Guesthouse Vienna', 'the guest house, Führichgasse, Kärntner Viertel, KG Innere Stadt, Innere Stadt, Wien, 1010, Österreich', 48.2051299, 16.369036]"
AT,Vienna,"['Mercure Hotel Raphael Wien', '23, Wallgasse, Obere Windmühle, KG Mariahilf, Mariahilf, Wien, 1060, Österreich', 48.1919288, 16.3391395]"
AT,Vienna,"['The Harmonie Vienna', '5-7, Harmoniegasse, Thurygrund II, KG Alsergrund, Alsergrund, Wien, 1090, Österreich', 48.2199427, 16.3598984]"
AT,Vienna,"['BEST WESTERN PLUS Amedia Wien', 'Amedia Hotel, 155, Landstraßer Hauptstraße, St. Marx, KG Landstraße, Landstraße, Wien, 1030, Österreich', 48.1923791, 16.3994512]"
AT,Vienna,"['Arion Cityhotel Vienna und Appartements', 'Arion Cityhotel, 1, Hintschiggasse, Siedlung Wienerberg-Süd, KG Inzersdorf Stadt, Favoriten, Wien, 1100, Österreich', 48.1585332, 16.3451115]"
AT,Vienna,"['Austria Trend Hotel Astoria Wien', 'Rosenberger Markt-Restaurant, 2, Maysedergasse, Kärntner Viertel, KG Innere Stadt, Innere Stadt, Wien, 1010, Österreich', 48.2044655, 16.3702399]"
AT,Vienna,"['Hotel Boltzmann', 'Hotel Boltzmann, 8, Boltzmanngasse, Thurygrund II, KG Alsergrund, Alsergrund, Wien, 1090, Österreich', 48.2216779, 16.3567111]"
AT,Vienna,"['The Levante Parliament A Design Hotel', 'The Levante Parliament, 9, Auerspergstraße, Buchfeld, KG Josefstadt, Josefstadt, Wien, 1080, Österreich', 48.2083518, 16.354532]"
AT,Vienna,"['Hotel Beethoven Wien', '6, Papagenogasse, KG Mariahilf, Mariahilf, Wien, 1060, Österreich', 48.2000165, 16.3641802]"
AT,Vienna,"['Courtyard by Marriott Vienna Prater Messe', 'Courtyard by Marriott Wien Messe, 4, Trabrennstraße, Pratercottage, KG Leopoldstadt, Leopoldstadt, Wien, 1020, Österreich', 48.2130607, 16.4133973]"
AT,Vienna,"['Simm s Hotel', 'Pearle, 55-57, Simmeringer Hauptstraße, KG Simmering, Simmering, Wien, 1110, Österreich', 48.1790835, 16.4116997]"
AT,Vienna,"['Hotel Rathaus Wein Design', 'Hotel Rathaus, 13, Lange Gasse, Buchfeld, KG Josefstadt, Josefstadt, Wien, 1080, Österreich', 48.2075294, 16.3525967]"
AT,Vienna,"['InterContinental Wien', 'Hotel InterContinental, 28, Johannesgasse, KG Innere Stadt, Innere Stadt, Wien, 1037, Österreich', 48.2019865, 16.3789934]"
AT,Vienna,"['JUFA Hotel Wien', 'JUFA Wien, 50-54, Mautner-Markhof-Gasse, KG Simmering, Simmering, Wien, 1110, Österreich', 48.1756283, 16.4200957]"
AT,Vienna,"['Hotel de France Wien', '4, Maria-Theresien-Straße, KG Alsergrund, Alsergrund, Wien, 1010, Österreich', 48.2146623, 16.3627994]"
AT,Vienna,"['Novotel Wien City', '1, Aspernbrückengasse, Afrikanerviertel, KG Leopoldstadt, Leopoldstadt, Wien, 1020, Österreich', 48.2134246, 16.3831309]"
AT,Vienna,"['Hotel Imlauer Wien', '10, Rotensterngasse, Afrikanerviertel, KG Leopoldstadt, Leopoldstadt, Wien, 1020, Österreich', 48.2176776, 16.3821364]"
AT,Vienna,"['Graben Hotel', 'Graben, 3, Dorotheergasse, Kärntner Viertel, KG Innere Stadt, Innere Stadt, Wien, 1010, Österreich', 48.2078955, 16.3701084]"
AT,Vienna,"['Hotel Das Tigra', '14, Tiefer Graben, Schottenviertel, KG Innere Stadt, Innere Stadt, Wien, 1010, Österreich', 48.2121772, 16.3680771]"
AT,Vienna,"['Hotel Mercure Wien City', '3, Hollandstraße, Karmeliterviertel, KG Leopoldstadt, Leopoldstadt, Wien, 1020, Österreich', 48.2152663, 16.376103]"
AT,Vienna,"['NH Danube City', 'NH Danube City, 21, Wagramer Straße, KG Kaisermühlen, Donaustadt, Neukagran, Wien, 1220, Österreich', 48.2353789, 16.4219737]"
AT,Vienna,"['Hotel Landhaus Fuhrgassl Huber', 'Landhaus Fuhrgassl-Huber, 24, Rathstraße, KG Neustift am Walde, Döbling, Wien, 1190, Österreich', 48.2508693, 16.304957]"
AT,Vienna,"['Mercure Josefshof Wien', 'Hotel Mercure Josefshof Wien Am Rathaus, 4-6, Josefsgasse, Buchfeld, KG Josefstadt, Josefstadt, Wien, 1080, Österreich', 48.2085627, 16.3541687]"
AT,Vienna,"['Hotel Am Parkring', 'Gartenbauhochhaus, 12, Parkring, Stubenviertel, KG Innere Stadt, Innere Stadt, Wien, 1010, Österreich', 48.2056333, 16.3778615]"
AT,Vienna,"['Fleming s Conference Hotel Wien', '26, Neubaugürtel, Lerchenfeld, KG Neubau, Neubau, Wien, 1070, Österreich', 48.1995177, 16.3388225]"
AT,Vienna,"['Am Spiegeln', 'Am Spiegeln, 30, Johann-Hörbiger-Gasse, Sauberg, KG Mauer, Liesing, Wien, 1230, Österreich', 48.1537005, 16.2825822]"
AT,Vienna,"['Imperial Riding School Renaissance Vienna Hotel', 'The Imperial Riding School Vienna, 60, Ungargasse, Fasanviertel, KG Landstraße, Landstraße, Wien, 1030, Österreich', 48.1966396, 16.3863822]"
AT,Vienna,"['Leonardo Hotel Vienna', 'Hotel Leonardo, 6,8, Matrosengasse, Obere Windmühle, KG Mariahilf, Mariahilf, Wien, 1060, Österreich', 48.1945297, 16.340327]"
AT,Vienna,"['Mercure Wien Zentrum', 'Bermudadreieck, Seitenstettengasse, Bermudadreieck, KG Innere Stadt, Innere Stadt, Wien, 1010, Österreich', 48.2114087, 16.3746469]"
AT,Vienna,"['Schlosshotel R mischer Kaiser', 'Römischer Kaiser, 16, Annagasse, Kärntner Viertel, KG Innere Stadt, Innere Stadt, Wien, 1010, Österreich', 48.2040859, 16.3725046]"
AT,Vienna,"['Hilton Vienna Danube Waterfront', 'Hilton Vienna Danube Waterfront, 269, Handelskai, Stuwerviertel, KG Leopoldstadt, Leopoldstadt, Wien, 1020, Österreich', 48.2140659, 16.4217627]"
AT,Vienna,"['Hotel Mailberger Hof', '7, Annagasse, Kärntner Viertel, KG Innere Stadt, Innere Stadt, Wien, 1010, Österreich', 48.204183, 16.3726664]"
AT,Vienna,"['Atlantis Hotel Vienna', '21, Wurzbachgasse, Nibelungenviertel, KG Fünfhaus, Rudolfsheim-Fünfhaus, Wien, 1150, Österreich', 48.2037451, 16.3356767]"
AT,Vienna,"['Hotel K nig von Ungarn', 'Königin von Ungarn, 10, Schulerstraße, Stubenviertel, KG Innere Stadt, Innere Stadt, Wien, 1010, Österreich', 48.2082215, 16.3751842]"
AT,Vienna,"['Saint SHERMIN bed breakfast champagne', '7, Rilkeplatz, Freihausviertel, KG Wieden, Wieden, Wien, 1040, Österreich', 48.1978409, 16.367087]"
AT,Vienna,"['Hotel Imperial A Luxury Collection Hotel', 'Imperial, 16, Kärntner Ring, Kärntner Viertel, KG Innere Stadt, Innere Stadt, Wien, 1010, Österreich', 48.2012505, 16.3731255]"
AT,Vienna,"['Strandhotel Alte Donau', 'strandhotel alte donau, An der oberen Alten Donau, KG Kagran, Donaustadt, Neukagran, Wien, 1220, Österreich', 48.2390022, 16.4292329]"
